{
  "$schema": "https://json-schema.org/draft/2020-12/schema",
  "$id": "https://sas-math.ai/schema/game-config-0.1.json",
  "title": "SaS-Math AI Game Config",
  "description": "DRAFT v0.1 — single source of truth for the game math config. Generates TypeScript (frontend), Pydantic (ai-layer), and Rust serde (core-math). See docs/design-decisions.md ADR-004. Money is always in integer smallest-units (ADR-002). This draft covers a 5x3 lines game; finalized and wired to codegen in M1.",
  "type": "object",
  "additionalProperties": false,
  "required": ["schema_version", "game", "symbols", "reels", "paytable", "paylines", "line_eval", "max_win", "rng"],
  "properties": {
    "schema_version": {
      "description": "Bump on ANY schema change. Old configs must reproduce identical math forever (ADR-004).",
      "type": "string",
      "const": "0.1.0"
    },
    "game": {
      "type": "object",
      "additionalProperties": false,
      "required": ["name", "grid", "bet_units", "denomination_scale"],
      "properties": {
        "name": { "type": "string", "minLength": 1 },
        "grid": {
          "type": "object",
          "additionalProperties": false,
          "required": ["reels", "rows"],
          "properties": {
            "reels": { "type": "integer", "minimum": 1, "default": 5 },
            "rows": { "type": "integer", "minimum": 1, "default": 3 }
          }
        },
        "bet_units": {
          "description": "Total bet for one spin, in integer smallest-units (the RTP denominator).",
          "type": "integer",
          "minimum": 1
        },
        "denomination_scale": {
          "description": "Smallest-units per credit (e.g. 100 = cents). For rendering only.",
          "type": "integer",
          "minimum": 1,
          "default": 100
        }
      }
    },
    "symbols": {
      "type": "array",
      "minItems": 1,
      "items": {
        "type": "object",
        "additionalProperties": false,
        "required": ["id", "name", "kind"],
        "properties": {
          "id": { "type": "integer", "minimum": 0, "description": "Stable index used by reels/paytable." },
          "name": { "type": "string", "minLength": 1 },
          "kind": { "type": "string", "enum": ["regular", "wild", "scatter"] },
          "substitutes_for": {
            "description": "For wilds: symbol ids this wild substitutes (scatters usually excluded).",
            "type": "array",
            "items": { "type": "integer", "minimum": 0 },
            "default": []
          }
        }
      }
    },
    "reels": {
      "description": "Exactly one representation. 'strips' = physical reel strips (preserves adjacency/positional structure). 'weights' = virtual-reel symbol weights per reel (solver-friendly; must be realized to a strip and re-verified, ADR-006).",
      "oneOf": [
        {
          "type": "object",
          "additionalProperties": false,
          "required": ["strips"],
          "properties": {
            "strips": {
              "type": "array",
              "description": "One array of symbol ids per reel.",
              "items": { "type": "array", "items": { "type": "integer", "minimum": 0 }, "minItems": 1 },
              "minItems": 1
            }
          }
        },
        {
          "type": "object",
          "additionalProperties": false,
          "required": ["weights"],
          "properties": {
            "weights": {
              "type": "array",
              "description": "One {symbol_id: weight} map per reel.",
              "items": {
                "type": "object",
                "additionalProperties": { "type": "integer", "minimum": 0 },
                "minProperties": 1
              },
              "minItems": 1
            }
          }
        }
      ]
    },
    "paytable": {
      "description": "Per symbol id, the payout (in bet_units multiples * 1, integer smallest-units) for each winning count.",
      "type": "array",
      "items": {
        "type": "object",
        "additionalProperties": false,
        "required": ["symbol_id", "pays"],
        "properties": {
          "symbol_id": { "type": "integer", "minimum": 0 },
          "pays": {
            "description": "Map of match-count -> payout in integer smallest-units. e.g. {\"3\": 500, \"4\": 2000, \"5\": 10000}.",
            "type": "object",
            "patternProperties": { "^[1-9][0-9]*$": { "type": "integer", "minimum": 0 } },
            "additionalProperties": false,
            "minProperties": 1
          }
        }
      }
    },
    "paylines": {
      "description": "Each payline is a row index (0-based) per reel. Length must equal game.grid.reels.",
      "type": "array",
      "minItems": 1,
      "items": { "type": "array", "items": { "type": "integer", "minimum": 0 }, "minItems": 1 }
    },
    "line_eval": {
      "description": "Win-evaluation semantics. The #1 place parity tests fail at the 2nd-3rd decimal; the chosen rule is part of the certified math.",
      "type": "string",
      "enum": ["left_to_right", "both_ways", "ways_243"],
      "default": "left_to_right"
    },
    "max_win": {
      "description": "Hard cap, modeled INSIDE the math, not as a post-step (ADR-005).",
      "type": "object",
      "additionalProperties": false,
      "required": ["cap_x"],
      "properties": {
        "cap_x": { "description": "Max total win as a multiple of total bet (e.g. 5000).", "type": "number", "exclusiveMinimum": 0 }
      }
    },
    "rng": {
      "type": "object",
      "additionalProperties": false,
      "required": ["generator", "master_seed"],
      "properties": {
        "generator": {
          "description": "Counter-based, namespaced (ADR-003). Never a sequential/LCG generator.",
          "type": "string",
          "enum": ["philox", "threefry", "chacha"],
          "default": "philox"
        },
        "master_seed": { "type": "integer", "minimum": 0 }
      }
    },
    "features": {
      "description": "Modular 'Lego-block' mechanics. Empty for the v0.1 base lines game; expanded in M4 (cascades, expanding wilds, multipliers) with declared recursion caps (ADR-011).",
      "type": "array",
      "items": { "type": "object" },
      "default": []
    },
    "targets": {
      "description": "Optional solver targets (M2). Not part of the math; consumed by the auto-tuner.",
      "type": "object",
      "additionalProperties": false,
      "properties": {
        "rtp": { "type": "number", "minimum": 0, "maximum": 2 },
        "volatility": { "type": "string", "enum": ["low", "medium", "medium-high", "high", "extreme"] },
        "hit_frequency": { "type": "number", "minimum": 0, "maximum": 1 },
        "bonus_frequency": { "type": "number", "minimum": 0, "maximum": 1 }
      }
    }
  }
}
