{
  "schema_version": "0.1.0",
  "game": {
    "name": "Sample 5x3 (cap 50x)",
    "grid": {
      "reels": 5,
      "rows": 3
    },
    "bet_units": 20,
    "denomination_scale": 100
  },
  "symbols": [
    {
      "id": 0,
      "name": "WILD",
      "kind": "wild",
      "substitutes_for": [
        2,
        3,
        4,
        5,
        6
      ]
    },
    {
      "id": 1,
      "name": "SCATTER",
      "kind": "scatter"
    },
    {
      "id": 2,
      "name": "H1",
      "kind": "regular"
    },
    {
      "id": 3,
      "name": "H2",
      "kind": "regular"
    },
    {
      "id": 4,
      "name": "L1",
      "kind": "regular"
    },
    {
      "id": 5,
      "name": "L2",
      "kind": "regular"
    },
    {
      "id": 6,
      "name": "L3",
      "kind": "regular"
    }
  ],
  "reels": {
    "strips": [
      [
        4,
        5,
        6,
        3,
        2,
        1,
        4,
        5,
        6,
        3,
        0,
        2,
        4,
        5,
        6,
        3,
        1,
        4,
        5,
        6,
        2,
        3,
        4,
        5,
        6,
        0,
        1,
        2,
        3,
        4,
        5,
        6
      ],
      [
        4,
        5,
        6,
        3,
        2,
        1,
        4,
        5,
        6,
        3,
        0,
        2,
        4,
        5,
        6,
        3,
        1,
        4,
        5,
        6,
        2,
        3,
        4,
        5,
        6,
        0,
        1,
        2,
        3,
        4,
        5,
        6
      ],
      [
        4,
        5,
        6,
        3,
        2,
        1,
        4,
        5,
        6,
        3,
        0,
        2,
        4,
        5,
        6,
        3,
        1,
        4,
        5,
        6,
        2,
        3,
        4,
        5,
        6,
        0,
        1,
        2,
        3,
        4,
        5,
        6
      ],
      [
        4,
        5,
        6,
        3,
        2,
        1,
        4,
        5,
        6,
        3,
        0,
        2,
        4,
        5,
        6,
        3,
        1,
        4,
        5,
        6,
        2,
        3,
        4,
        5,
        6,
        0,
        1,
        2,
        3,
        4,
        5,
        6
      ],
      [
        4,
        5,
        6,
        3,
        2,
        1,
        4,
        5,
        6,
        3,
        0,
        2,
        4,
        5,
        6,
        3,
        1,
        4,
        5,
        6,
        2,
        3,
        4,
        5,
        6,
        0,
        1,
        2,
        3,
        4,
        5,
        6
      ]
    ]
  },
  "paytable": [
    {
      "symbol_id": 0,
      "pays": {
        "3": 60,
        "4": 240,
        "5": 900
      }
    },
    {
      "symbol_id": 1,
      "pays": {
        "3": 6,
        "4": 30,
        "5": 150
      }
    },
    {
      "symbol_id": 2,
      "pays": {
        "3": 30,
        "4": 120,
        "5": 480
      }
    },
    {
      "symbol_id": 3,
      "pays": {
        "3": 24,
        "4": 75,
        "5": 360
      }
    },
    {
      "symbol_id": 4,
      "pays": {
        "3": 12,
        "4": 36,
        "5": 150
      }
    },
    {
      "symbol_id": 5,
      "pays": {
        "3": 9,
        "4": 24,
        "5": 90
      }
    },
    {
      "symbol_id": 6,
      "pays": {
        "3": 6,
        "4": 18,
        "5": 75
      }
    }
  ],
  "paylines": [
    [
      1,
      1,
      1,
      1,
      1
    ],
    [
      0,
      0,
      0,
      0,
      0
    ],
    [
      2,
      2,
      2,
      2,
      2
    ],
    [
      0,
      1,
      2,
      1,
      0
    ],
    [
      2,
      1,
      0,
      1,
      2
    ],
    [
      1,
      0,
      1,
      0,
      1
    ],
    [
      1,
      2,
      1,
      2,
      1
    ],
    [
      0,
      0,
      1,
      2,
      2
    ],
    [
      2,
      2,
      1,
      0,
      0
    ],
    [
      1,
      1,
      0,
      1,
      2
    ]
  ],
  "line_eval": "left_to_right",
  "max_win": {
    "cap_x": 50
  },
  "rng": {
    "generator": "chacha",
    "master_seed": 20260616
  }
}